,Unnamed: 0,id,domain,title,author,created_utc,score,url,gilded,permalink,num_comments,subreddit
8,640620,674s6l,twitter.com,"If you agree with one sign, but not the other, you?re part of the problem",Da_Kahuna,1492982174,2,https://twitter.com/Jenn_Abrams/status/856137891461959680,0,/r/Conservative/comments/674s6l/if_you_agree_with_one_sign_but_not_the_other/,0,Conservative
27,639938,53euzf,twitter.com,Some guy right in Hillary's face: Hillary for Prison. Hillary: Let's make it happen!,UA_Hammer,1474242463,15,https://twitter.com/Jenn_Abrams/status/777548437273255937,0,/r/Conservative/comments/53euzf/some_guy_right_in_hillarys_face_hillary_for/,3,Conservative
433,639373,6ob5ry,twitter.com,Here's a fun video of President Obama encouraging Dreamers (with no citizenship or legal residency) to vote.,bigkr88,1500495155,54,https://twitter.com/pamela_moore13/status/887765519197061120,0,/r/Conservative/comments/6ob5ry/heres_a_fun_video_of_president_obama_encouraging/,13,Conservative
434,639440,6df20f,twitter.com,"""You know what's morally bankrupt? Leaving my grandchildren $30 Trillion in debt"" - Mulvaney",[deleted],1495776696,1,https://twitter.com/Pamela_Moore13/status/867873308494245890,0,/r/Conservative/comments/6df20f/you_know_whats_morally_bankrupt_leaving_my/,0,Conservative
0,640701,6wffup,twitter.com,(VIDEO) Antifa terrorists attacking father and son in Berkeley. No police in sight,Trussed_Up,1503875035,1,https://twitter.com/realTEN_GOP/status/901929194711592960,0,/r/Conservative/comments/6wffup/video_antifa_terrorists_attacking_father_and_son/,0,Conservative
12,640825,5yciey,twitter.com,Linda Sarsour arrested,talonrequiresskill,1489027218,38,https://twitter.com/southlonestar/status/839580930213720064,0,/r/Conservative/comments/5yciey/linda_sarsour_arrested/,4,Conservative
1169,639898,67089g,twitter.com,"Black guy goes off on Muslims and Liberals after seeing Michigan Muslims drive and $67,000 cars while getting government handouts.",CedTruz,1492918584,1,https://twitter.com/ten_gop/status/843492184871657472,0,/r/Conservative/comments/67089g/black_guy_goes_off_on_muslims_and_liberals_after/,0,Conservative
1170,639911,616l5f,twitter.com,CNN &amp; MSNBC Use The Same 'Live' Guest On Air,prkrrlz,1490324178,17,https://twitter.com/TEN_GOP/status/845105749688631296,0,/r/Conservative/comments/616l5f/cnn_msnbc_use_the_same_live_guest_on_air/,0,Conservative
