,Unnamed: 0,id,domain,title,author,created_utc,score,url,gilded,permalink,num_comments,subreddit
4,308260,4bdvcx,twitter.com,"United States of America: We ask them not to shoot us and are called anti-police, they kill us and nothing changes",30ustice4,1458589052,1,https://twitter.com/BleepThePolice/status/711956864653594624/video/1,0,/r/worldnews/comments/4bdvcx/united_states_of_america_we_ask_them_not_to_shoot/,0,worldnews
2,307692,5n6bvf,twitter.com,Cashiers in Ukraine get a hard time for speaking the Russian language.,lizachka,1484069285,1,https://twitter.com/MargoSavazh/status/818773096412876801,0,/r/worldnews/comments/5n6bvf/cashiers_in_ukraine_get_a_hard_time_for_speaking/,1,worldnews
3,307728,6rl4yf,twitter.com,Julian Assange: I investigated both presidential candidates ? Hillary received Millions in Russians investments while Donald was denied Russian contracts.,[deleted],1501859961,1,https://twitter.com/Pamela_Moore13/status/892570543261724674,0,/r/worldnews/comments/6rl4yf/julian_assange_i_investigated_both_presidential/,0,worldnews
9,307783,5bilw2,twitter.com,Tennessee GOP on Twitter: 'Jay Sekulow: 'There's no question in my mind that the FBI Director Comey never really intended to do an investigation Hillary Clinton.' https://t.co/KX2wf4j4Gg',ageanvelos,1478472316,1,https://twitter.com/TEN_GOP/status/795390108107214848#.WB-ybdnjDyI.reddit,0,/r/worldnews/comments/5bilw2/tennessee_gop_on_twitter_jay_sekulow_theres_no/,0,worldnews
461,308484,5z1e5d,twitter.com,"Tennessee on Twitter: """"Immigration is an organized replacement of our population. This threatens our very survival"" ~ Marine Le Pen #SundayMorning 'Steve King' https://t.co/kmowVt0RdL""",ageanvelos,1489357608,1,https://twitter.com/TEN_GOP/status/841051413627174912,0,/r/worldnews/comments/5z1e5d/tennessee_on_twitter_immigration_is_an_organized/,2,worldnews
462,308488,5p09xm,twitter.com,"Tennessee GOP on Twitter: ""These celebs have less than a week to pack their bags and leave the U.S. as they promised. Kindly RT to remind them! https://t.co/D5zMGgVptP""",ageanvelos,1484868828,1,https://twitter.com/TEN_GOP/status/820134296245727232,0,/r/worldnews/comments/5p09xm/tennessee_gop_on_twitter_these_celebs_have_less/,1,worldnews
