,id,domain,title,author,created_utc,score,url,gilded,permalink,num_comments,subreddit
411100,5wpuyf,twitter.com,These Kurdish girls are retaking Raqqa from ISIS right now while liberal women ask for more privileges.,netsql,1488309089,110,https://twitter.com/SouthLoneStar/status/836646236388229121,0,/r/The_Donald/comments/5wpuyf/these_kurdish_girls_are_retaking_raqqa_from_isis/,4,The_Donald
419269,674eym,twitter.com,Chicago approves new plan to hide illegals from the feds &amp; gives them access to city services.,[deleted],1492978292,19,https://twitter.com/SouthLoneStar/status/856238924334845952,0,/r/The_Donald/comments/674eym/chicago_approves_new_plan_to_hide_illegals_from/,0,The_Donald
419313,6ci982,twitter.com,"CNN once claimed ""Trump will never be welcome in Islamic countries if elected president"" Think again, CNN",[deleted],1495392947,12,https://twitter.com/SouthLoneStar/status/866366774543036416,0,/r/The_Donald/comments/6ci982/cnn_once_claimed_trump_will_never_be_welcome_in/,0,The_Donald
420931,5ybgsy,twitter.com,"HAPPY WEDNESDAY! ""Islamic terrorist Linda Sarsour was just arrested outside Trump International for disorderly conduct""",[deleted],1489015443,11,https://twitter.com/SouthLoneStar/status/839580930213720064,0,/r/The_Donald/comments/5ybgsy/happy_wednesday_islamic_terrorist_linda_sarsour/,0,The_Donald
421572,67d7jv,twitter.com,Thousands march through Los Angeles remembering the victims of #ArmenianGenocide Muslm-loving media completely ignore this,[deleted],1493080734,117,https://twitter.com/SouthLoneStar/status/856666367789080576,0,/r/The_Donald/comments/67d7jv/thousands_march_through_los_angeles_remembering/,1,The_Donald
423538,6braiv,twitter.com,Poland says taking migrants is 'much worse' than EU sanctions. Poles are the only sane people in Europe.,[deleted],1495052353,18,https://twitter.com/SouthLoneStar/status/864936808647413761,0,/r/The_Donald/comments/6braiv/poland_says_taking_migrants_is_much_worse_than_eu/,1,The_Donald
426091,5yvuhi,twitter.com,Former #WhiteHouse officials told by #Obama to sabotage &amp; smear the #TrumpAdministration,[deleted],1489277392,22,https://twitter.com/SouthLoneStar/status/840705714213404673,0,/r/The_Donald/comments/5yvuhi/former_whitehouse_officials_told_by_obama_to/,1,The_Donald
427944,5v7ty6,twitter.com,Footage of the vibrant displays of diversity happening in Paris this week,jimmybda3,1487631391,7,https://twitter.com/SouthLoneStar/status/833505336216649728,0,/r/The_Donald/comments/5v7ty6/footage_of_the_vibrant_displays_of_diversity/,1,The_Donald
432832,5ygy4v,mobile.twitter.com,Sharia bitch Linda Sarsour got arrested in front of Trump Tower,TheGreatRoh,1489085781,29,https://mobile.twitter.com/southlonestar/status/839580930213720064,0,/r/The_Donald/comments/5ygy4v/sharia_bitch_linda_sarsour_got_arrested_in_front/,0,The_Donald
435964,5v2151,twitter.com,THIS TRIGGERS THE CUCKS..UP TO r/ FRONT,xVoltage360,1487557689,31,https://twitter.com/SouthLoneStar/status/833416458801647617,0,/r/The_Donald/comments/5v2151/this_triggers_the_cucksup_to_r_front/,1,The_Donald
440814,5p61sv,twitter.com,"Best video ever ?? Trump supporter says ""Fuck you!"" to the protesters. #inauguration",NorthJersey908,1484940672,10,https://twitter.com/SouthLoneStar/status/822521560367919105,0,/r/The_Donald/comments/5p61sv/best_video_ever_trump_supporter_says_fuck_you_to/,1,The_Donald
444911,61ev8z,twitter.com,"Criticism of Islam is no longer legal in Canada. The anti-Islamophobia motion, M-103, passed by a margin of 201 to 91 by Canada's Parliament.",real_bbc_history,1490435967,126,https://twitter.com/SouthLoneStar/status/845043356598120448,0,/r/The_Donald/comments/61ev8z/criticism_of_islam_is_no_longer_legal_in_canada/,14,The_Donald
640825,5yciey,twitter.com,Linda Sarsour arrested,talonrequiresskill,1489027218,38,https://twitter.com/southlonestar/status/839580930213720064,0,/r/Conservative/comments/5yciey/linda_sarsour_arrested/,4,Conservative
834845,5xcnxr,twitter.com,"Texas Lone Star on Twitter: Juan Thompson, leftist Jewish center threat master, was buddies with Shillary",SchlangeHatRecht,1488571623,28,https://twitter.com/SouthLoneStar/status/837742545694154753,0,/r/HillaryForPrison/comments/5xcnxr/texas_lone_star_on_twitter_juan_thompson_leftist/,1,HillaryForPrison
411746,685at8,twitter.com,Disrupting meetings and rallies of opponents with violence is a Nazi method to gain control over a country,Sy0007,1493412135,472,https://twitter.com/SouthLoneStar/status/858038111552622592,0,/r/The_Donald/comments/685at8/disrupting_meetings_and_rallies_of_opponents_with/,9,The_Donald
412275,4aww01,twitter.com,4500 leftists planning to siege Trump Tower on Saturday March 20... its gonna get ugly!!!,vctr88,1458276302,4,https://twitter.com/southlonestar/status/710309514969481216,0,/r/The_Donald/comments/4aww01/4500_leftists_planning_to_siege_trump_tower_on/,2,The_Donald
413614,5r3e08,twitter.com,Fun fact: Starbucks CEO officially endorsed Hillary Clinton. And then liberal rioters destroyed one of its restaura… https://t.co/u0nMoFI6h2 - @SouthLoneStar,Simi510,1485808784,384,https://twitter.com/SouthLoneStar/status/826122676569853952,0,/r/The_Donald/comments/5r3e08/fun_fact_starbucks_ceo_officially_endorsed/,2,The_Donald
422619,67bwow,twitter.com,Home of Antifa thug alerted to police raided. Cops found M-80s and smoke bombs. Looks like the thug plotted a terrorist attack.,[deleted],1493067370,11,https://twitter.com/SouthLoneStar/status/856612552142454784,0,/r/The_Donald/comments/67bwow/home_of_antifa_thug_alerted_to_police_raided_cops/,0,The_Donald
426180,69a9f7,twitter.com,Muslim cleric in Germany warns Germans at a city square: Sharia Law is coming. Your daughters will marry Muslims.,[deleted],1493931083,16,https://twitter.com/SouthLoneStar/status/860233962060468225,0,/r/The_Donald/comments/69a9f7/muslim_cleric_in_germany_warns_germans_at_a_city/,0,The_Donald
426450,6be98x,twitter.com,Trump to light White House blue to honor cops. FLASHBACK: Obama refused cops' request to do the same.,[deleted],1494894783,20,https://twitter.com/SouthLoneStar/status/864232252590485506,0,/r/The_Donald/comments/6be98x/trump_to_light_white_house_blue_to_honor_cops/,2,The_Donald
427634,65s3ja,twitter.com,"BREAKING: There's been a double shooting reported in Lynn, Mass",[deleted],1492384891,19,https://twitter.com/SouthLoneStar/status/853750112480374785,0,/r/The_Donald/comments/65s3ja/breaking_theres_been_a_double_shooting_reported/,3,The_Donald
438267,4btlzb,twitter.com,"Anti-muslim protesters in Slovenia chant 'Donald Trump, Donald Trump'",cynicsrising,1458854259,1093,https://twitter.com/SouthLoneStar/status/713092443323768832,0,/r/The_Donald/comments/4btlzb/antimuslim_protesters_in_slovenia_chant_donald/,60,The_Donald
440031,5yaq73,twitter.com,Islamic terrorist Linda Sarsour was just arrested outside Trump International for disorderly conduct #InternationalWomensDay #NotMyProtest,bob_doobalina,1489008134,8626,https://twitter.com/southlonestar/status/839580930213720064,0,/r/The_Donald/comments/5yaq73/islamic_terrorist_linda_sarsour_was_just_arrested/,220,The_Donald
443534,5jujg1,twitter.com,This douchebag harassed Ivanka and her kids on the plane - Share!,BaskervilleBill,1482458385,78,https://twitter.com/SouthLoneStar/status/812000177309577220,0,/r/The_Donald/comments/5jujg1/this_douchebag_harassed_ivanka_and_her_kids_on/,4,The_Donald
444113,4styhd,twitter.com,"BASED Pastor Mark Burns: ""There is only one color that matters. The color of red, white and blue""",Marquis_de_Faux,1468511555,11,https://twitter.com/SouthLoneStar/status/720058711662723072,0,/r/The_Donald/comments/4styhd/based_pastor_mark_burns_there_is_only_one_color/,2,The_Donald
446443,6789wd,twitter.com,"Definition of ""terrorism""",MenziesTheHeretic,1493030583,37,https://twitter.com/southlonestar/status/856284640402976768,0,/r/The_Donald/comments/6789wd/definition_of_terrorism/,0,The_Donald
721256,5ygy59,mobile.twitter.com,Sharia bitch Linda Sarsour got arrested in front of Trump Tower,td_bot2,1489085785,1,https://mobile.twitter.com/southlonestar/status/839580930213720064,0,/r/td_uncensored/comments/5ygy59/sharia_bitch_linda_sarsour_got_arrested_in_front/,0,td_uncensored
890691,5yc74d,twitter.com,[TDD] Islamic terrorist Linda Sarsour was just arrested outside Trump International for disorderly conduct #InternationalWomensDay #NotMyProtest,tdd_bot,1489023543,1,https://twitter.com/southlonestar/status/839580930213720064,0,/r/The_Donald_Discuss/comments/5yc74d/tdd_islamic_terrorist_linda_sarsour_was_just/,1,The_Donald_Discuss
265311,5s6xuv,mobile.twitter.com,White girl brutally beaten by BLM activists,[deleted],1486294034,1,https://mobile.twitter.com/SouthLoneStar/status/828065060249563136,0,/r/politics/comments/5s6xuv/white_girl_brutally_beaten_by_blm_activists/,1,politics
417764,4zc14s,twitter.com,Unsecured network at Trump Austin rally called Clinton Email Server. Pure gold #TrumpinATX #SickHillary,TheVoiper,1472037082,501,https://twitter.com/southlonestar/status/768261476759003136,0,/r/The_Donald/comments/4zc14s/unsecured_network_at_trump_austin_rally_called/,2,The_Donald
419632,5x7cbp,twitter.com,Schumer and Vladimir having a few laughs,[deleted],1488503212,9,https://twitter.com/SouthLoneStar/status/837441494055165953,0,/r/The_Donald/comments/5x7cbp/schumer_and_vladimir_having_a_few_laughs/,0,The_Donald
423023,65xk91,twitter.com,BREAKING: Black Hawk Helicopter Crashes In Maryland,[deleted],1492455528,27,https://twitter.com/SouthLoneStar/status/854046228102905856,0,/r/The_Donald/comments/65xk91/breaking_black_hawk_helicopter_crashes_in_maryland/,8,The_Donald
430824,4yufzb,twitter.com,MORE DNC VOTER FRAUD: Man PROVES software stole votes in ALL 'Hillary won' counties! DNC rigged elections,Blameocrats,1471779204,3,https://twitter.com/SouthLoneStar/status/759086833548525568,0,/r/The_Donald/comments/4yufzb/more_dnc_voter_fraud_man_proves_software_stole/,1,The_Donald
444001,61euqd,twitter.com,"""When you wanna please Allah, but you also wanna please Abdullah"" Texas Lone Star? @SouthLoneStar",real_bbc_history,1490435631,26,https://twitter.com/SouthLoneStar/status/845113021689061377,0,/r/The_Donald/comments/61euqd/when_you_wanna_please_allah_but_you_also_wanna/,6,The_Donald
457863,5ycitz,mobile.twitter.com,Sharia bitch Linda Sarsour got arrested in front of Trump Tower,andrejw,1489027375,63,https://mobile.twitter.com/southlonestar/status/839580930213720064,0,/r/metacanada/comments/5ycitz/sharia_bitch_linda_sarsour_got_arrested_in_front/,9,metacanada
267074,514uo6,twitter.com,George Soros literally says Trump will win popular vote but it's already been decided that Clinton will be the POTUS,FourCounters,1473008589,1,https://twitter.com/SouthLoneStar/status/771055302045237249/video/1,0,/r/politics/comments/514uo6/george_soros_literally_says_trump_will_win/,1,politics
409138,50k74m,twitter.com,Soros says that it has been decided that Hillary will be a president so it does not matter how people vote,x-2y,1472686066,39,https://twitter.com/SouthLoneStar/status/771055302045237249,0,/r/The_Donald/comments/50k74m/soros_says_that_it_has_been_decided_that_hillary/,11,The_Donald
412826,5rbxqq,twitter.com,RT @SouthLoneStar: Swedish Police Chief to Swedish girls: ‘Don’t go out after sunset or you’ll be raped or worse’ (by rapefugees)… https://t.co/PUE75iHPga - @TEN_GOP,Simi510,1485906138,23,https://twitter.com/SouthLoneStar/status/826562419493318657,0,/r/The_Donald/comments/5rbxqq/rt_southlonestar_swedish_police_chief_to_swedish/,0,The_Donald
420014,5thag1,twitter.com,Muslims chant “Death to America!” You think it's Syria or Iran? Wrong. It's Chicago. Libs who support them = domestic terrorists,[deleted],1486844609,1,https://twitter.com/SouthLoneStar/status/830493943901147138,0,/r/The_Donald/comments/5thag1/muslims_chant_death_to_america_you_think_its/,0,The_Donald
423277,66kerr,twitter.com,Pres. Trump on Paris: “It looks like another terrorist attack. What can you say? It just never ends. We have to be strong.”,[deleted],1492719879,20,https://twitter.com/SouthLoneStar/status/855154944101502976,0,/r/The_Donald/comments/66kerr/pres_trump_on_paris_it_looks_like_another/,0,The_Donald
424678,5s5lvm,twitter.com,White girl brutally beaten by #BLM activists,[deleted],1486268883,3108,https://twitter.com/SouthLoneStar/status/828065060249563136,0,/r/The_Donald/comments/5s5lvm/white_girl_brutally_beaten_by_blm_activists/,96,The_Donald
430277,5yboc3,twitter.com,"BAM!!! — ""Islamic terrorist Linda Sarsour was just arrested outside Trump International for disorderly conduct #InternationalWomensDay #NotMyProtest""",noahbotti1,1489017699,76,https://twitter.com/SouthLoneStar/status/839580930213720064,0,/r/The_Donald/comments/5yboc3/bam_islamic_terrorist_linda_sarsour_was_just/,12,The_Donald
433989,5x72fd,twitter.com,Russia,macredsmile,1488500120,16,https://twitter.com/SouthLoneStar/status/837449841579970560,0,/r/The_Donald/comments/5x72fd/russia/,1,The_Donald
440731,65t3gl,twitter.com,Interview with a man and woman who said the man killed by Steve Stephens in the FB live video was their 78 yo father.,VirginWizard69,1492397317,706,https://twitter.com/SouthLoneStar/status/853727843649499136/video/1,0,/r/The_Donald/comments/65t3gl/interview_with_a_man_and_woman_who_said_the_man/,9,The_Donald
720396,5yaq7n,twitter.com,Islamic terrorist Linda Sarsour was just arrested outside Trump International for disorderly conduct #InternationalWomensDay #NotMyProtest,td_bot2,1489008139,1,https://twitter.com/southlonestar/status/839580930213720064,0,/r/td_uncensored/comments/5yaq7n/islamic_terrorist_linda_sarsour_was_just_arrested/,1,td_uncensored
